id,text,Not Toxic,Hard to Say,Toxic,Very Toxic,category_卑語,category_差別,category_迷惑行為,category_猥褻,category_出会い・プライバシー侵害,category_違法行為,category_偏向表現,annotation_num
898,キャラ被ってる気がするが,2,0,0,0,0,0,0,0,0,0,0,2
900,先週まで工事で行ってたけど,2,0,0,0,0,0,0,0,0,0,0,2
901,三国時代はよ,2,0,0,0,0,0,0,0,0,0,0,2
904,やっぱ精神科だな,1,1,0,0,0,1,0,0,0,0,0,2
906,あやしいが,2,0,0,0,0,0,0,0,0,0,0,2
907,相変わらず自民党、ゴミしか居ないじゃん,0,0,1,1,0,1,3,0,0,0,2,2
908,このつたない日本語を毎回聞かされるのか,0,2,0,0,0,1,1,0,0,0,0,2
911,ほんと玉無しだな手帳は,0,2,0,0,1,2,1,1,0,0,0,2
912,三球三振で引導渡してやれ,2,0,0,0,0,0,0,0,0,0,0,2
915,今日もアメリカは強えーなー。,2,0,0,0,0,0,0,0,0,0,0,2
916,次回予告みたなのやめ,2,0,0,0,0,0,0,0,0,0,0,2
918,いいショット,2,0,0,0,0,0,0,0,0,0,0,2
920,おつ,2,0,0,0,0,0,0,0,0,0,0,2
921,ソロホームランでいいから出て欲しい,2,0,0,0,0,0,0,0,0,0,0,2
925,相葉はほんと結婚関係ないね,2,0,0,0,0,0,0,0,0,0,0,2
930,ジュピター会議は知らんけど,2,0,0,0,0,0,0,0,0,0,0,2
933,国産以外嫌だわ,0,2,0,0,0,2,0,0,0,0,0,2
935,あいつらベトナム人で実験してるから,0,1,1,0,0,3,0,0,0,0,0,2
938,おまえは別の意味で惚れてる気がする,2,0,0,0,0,0,0,0,0,0,0,2
942,ツボ押しとマッサージでリラックスを促してる,2,0,0,0,0,0,0,0,0,0,0,2
943,合格した途端メガネキャラをあっさり捨てるあたりもな,2,0,0,0,0,0,0,0,0,0,0,2
944,射程短い機体はほぼ死んでる,2,0,0,0,0,0,0,0,0,0,0,2
947,ほんとあとは打つだけ,2,0,0,0,0,0,0,0,0,0,0,2
949,↑主語がない,2,0,0,0,0,0,0,0,0,0,0,2
950,リオン謝罪,2,0,0,0,0,0,0,0,0,0,0,2
951,素晴らしいな,2,0,0,0,0,0,0,0,0,0,0,2
952,広島なら完投させるんじゃね,2,0,0,0,0,0,0,0,0,0,0,2
953,ひ孫に囲まれるとかいいな,2,0,0,0,0,0,0,0,0,0,0,2
960,かなりの曲者だ,1,1,0,0,0,0,1,0,0,0,0,2
961,下げれるんだから下げてくれ,2,0,0,0,0,0,0,0,0,0,0,2
962,不整脈ですね,2,0,0,0,0,0,0,0,0,0,0,2
964,響消えてて草,2,0,0,0,0,0,0,0,0,0,0,2
967,アニメ自体はつまらないな・・・,2,0,0,0,0,0,0,0,0,0,0,2
968,あなたの言うとおりだわ,2,0,0,0,0,0,0,0,0,0,0,2
969,遠慮なく重ねろ,2,0,0,0,0,0,0,0,0,0,0,2
970,ダメになるようなら引っ越すわ,2,0,0,0,0,0,0,0,0,0,0,2
973,ルール守れというだけで発狂するんだし無理でしょ,0,2,0,0,0,0,2,0,0,0,0,2
975,基地外とか危険因子を取り除く事は必要だよ,0,0,1,1,0,2,1,0,0,0,1,2
977,奇才も混じっててよかったね,2,0,0,0,0,0,0,0,0,0,0,2
981,おっさんが好きそうなの続くな,2,0,0,0,0,0,0,0,0,0,0,2
982,大学生と貧困家族にあげろよ,2,0,0,0,0,0,0,0,0,0,0,2
983,これ巨人の優勝あるやろ,2,0,0,0,0,0,0,0,0,0,0,2
984,全く男として見ていない,1,0,1,0,0,0,1,0,0,0,0,2
985,よろんとうじゃないのか,2,0,0,0,0,0,0,0,0,0,0,2
986,第二の大口病院,2,0,0,0,0,0,0,0,0,0,0,2
989,この衣装カッコいい、可愛いから欲しいってやつ以外もう課金要素ないだろ,1,0,1,0,0,0,1,0,0,0,0,2
990,そこまで未練なら風俗行きゃいいじゃん,0,0,2,0,0,0,0,2,0,0,0,2
992,ボイスはもう少しバリエーション取ってくれ,1,1,0,0,0,0,0,0,0,0,0,2
993,ドンパチ聞こえないけど,2,0,0,0,0,0,0,0,0,0,0,2